[
  {
    "id": "ven-G01",
    "name": "Reception and Welcome Hall",
    "building": "Nagarro Gurgaon Office",
    "floor": "G",
    "zone": "Reception",
    "wing": "central",
    "mapZone": "reception",
    "capacity": 500,
    "description": "Ground-floor welcome hall for opening, closing, and all-hands sessions.",
    "landmarks": ["past Reception desk", "main auditorium doors ahead"],
    "nearestElevator": "central",
    "stepFree": true
  },
  {
    "id": "ven-C601",
    "name": "Community Cafeteria",
    "building": "Nagarro Gurgaon Office",
    "floor": "6",
    "zone": "Cafeteria",
    "wing": "N",
    "mapZone": "north",
    "capacity": 200,
    "description": "North wing social hub with curated 12:00 lightning talks and networking.",
    "landmarks": ["past North elevator bank", "cafeteria entrance on left"],
    "nearestElevator": "N",
    "stepFree": true
  },
  {
    "id": "ven-T601",
    "name": "Training Room 1",
    "building": "Nagarro Gurgaon Office",
    "floor": "6",
    "zone": "Training",
    "wing": "S",
    "mapZone": "south",
    "capacity": 60,
    "description": "South wing training room for live labs, workshops, and masterclasses.",
    "landmarks": ["past South elevator bank", "second door on right"],
    "nearestElevator": "S",
    "stepFree": true
  },
  {
    "id": "ven-T602",
    "name": "Training Room 2",
    "building": "Nagarro Gurgaon Office",
    "floor": "6",
    "zone": "Training",
    "wing": "S",
    "mapZone": "south",
    "capacity": 60,
    "description": "South wing training room for live labs, workshops, and masterclasses.",
    "landmarks": ["past South elevator bank", "third door on right"],
    "nearestElevator": "S",
    "stepFree": true
  },
  {
    "id": "ven-T603",
    "name": "Training Room 3",
    "building": "Nagarro Gurgaon Office",
    "floor": "6",
    "zone": "Training",
    "wing": "S",
    "mapZone": "south",
    "capacity": 60,
    "description": "South wing training room for live labs, workshops, and masterclasses.",
    "landmarks": ["past South elevator bank", "fourth door on right"],
    "nearestElevator": "S",
    "stepFree": false
  },
  {
    "id": "ven-T604",
    "name": "Training Room 4",
    "building": "Nagarro Gurgaon Office",
    "floor": "6",
    "zone": "Training",
    "wing": "S",
    "mapZone": "south",
    "capacity": 60,
    "description": "South wing training room for live labs, workshops, and masterclasses.",
    "landmarks": ["past South elevator bank", "end of south corridor"],
    "nearestElevator": "S",
    "stepFree": false
  },
  {
    "id": "ven-7N1",
    "name": "Floor 7 North Pod 1",
    "building": "Nagarro Gurgaon Office",
    "floor": "7",
    "zone": "Sitting Area",
    "wing": "N",
    "mapZone": "north",
    "capacity": 25,
    "description": "Small-group learning pod for practical sessions and peer discussions.",
    "landmarks": ["past North elevator bank", "first pod on left"],
    "nearestElevator": "N",
    "stepFree": true
  },
  {
    "id": "ven-7N2",
    "name": "Floor 7 North Pod 2",
    "building": "Nagarro Gurgaon Office",
    "floor": "7",
    "zone": "Sitting Area",
    "wing": "N",
    "mapZone": "north",
    "capacity": 30,
    "description": "Small-group learning pod for practical sessions and peer discussions."
  },
  {
    "id": "ven-7N3",
    "name": "Floor 7 North Pod 3",
    "building": "Nagarro Gurgaon Office",
    "floor": "7",
    "zone": "Sitting Area",
    "wing": "N",
    "mapZone": "north",
    "capacity": 20,
    "description": "Small-group learning pod for practical sessions and peer discussions."
  },
  {
    "id": "ven-7N4",
    "name": "Floor 7 North Pod 4",
    "building": "Nagarro Gurgaon Office",
    "floor": "7",
    "zone": "Sitting Area",
    "wing": "N",
    "mapZone": "north",
    "capacity": 25,
    "description": "Small-group learning pod for practical sessions and peer discussions."
  },
  {
    "id": "ven-7N5",
    "name": "Floor 7 North Pod 5",
    "building": "Nagarro Gurgaon Office",
    "floor": "7",
    "zone": "Sitting Area",
    "wing": "N",
    "mapZone": "north",
    "capacity": 30,
    "description": "Small-group learning pod for practical sessions and peer discussions."
  },
  {
    "id": "ven-7N6",
    "name": "Floor 7 North Pod 6",
    "building": "Nagarro Gurgaon Office",
    "floor": "7",
    "zone": "Sitting Area",
    "wing": "N",
    "mapZone": "north",
    "capacity": 20,
    "description": "Small-group learning pod for practical sessions and peer discussions."
  },
  {
    "id": "ven-7S1",
    "name": "Floor 7 South Pod 1",
    "building": "Nagarro Gurgaon Office",
    "floor": "7",
    "zone": "Sitting Area",
    "wing": "S",
    "mapZone": "south",
    "capacity": 25,
    "description": "Small-group learning pod for practical sessions and peer discussions."
  },
  {
    "id": "ven-7S2",
    "name": "Floor 7 South Pod 2",
    "building": "Nagarro Gurgaon Office",
    "floor": "7",
    "zone": "Sitting Area",
    "wing": "S",
    "mapZone": "south",
    "capacity": 30,
    "description": "Small-group learning pod for practical sessions and peer discussions."
  },
  {
    "id": "ven-7S3",
    "name": "Floor 7 South Pod 3",
    "building": "Nagarro Gurgaon Office",
    "floor": "7",
    "zone": "Sitting Area",
    "wing": "S",
    "mapZone": "south",
    "capacity": 20,
    "description": "Small-group learning pod for practical sessions and peer discussions."
  },
  {
    "id": "ven-7S4",
    "name": "Floor 7 South Pod 4",
    "building": "Nagarro Gurgaon Office",
    "floor": "7",
    "zone": "Sitting Area",
    "wing": "S",
    "mapZone": "south",
    "capacity": 25,
    "description": "Small-group learning pod for practical sessions and peer discussions."
  },
  {
    "id": "ven-7S5",
    "name": "Floor 7 South Pod 5",
    "building": "Nagarro Gurgaon Office",
    "floor": "7",
    "zone": "Sitting Area",
    "wing": "S",
    "mapZone": "south",
    "capacity": 30,
    "description": "Small-group learning pod for practical sessions and peer discussions."
  },
  {
    "id": "ven-7S6",
    "name": "Floor 7 South Pod 6",
    "building": "Nagarro Gurgaon Office",
    "floor": "7",
    "zone": "Sitting Area",
    "wing": "S",
    "mapZone": "south",
    "capacity": 20,
    "description": "Small-group learning pod for practical sessions and peer discussions."
  },
  {
    "id": "ven-8N1",
    "name": "Floor 8 North Pod 1",
    "building": "Nagarro Gurgaon Office",
    "floor": "8",
    "zone": "Sitting Area",
    "wing": "N",
    "mapZone": "north",
    "capacity": 25,
    "description": "Small-group learning pod for practical sessions and peer discussions."
  },
  {
    "id": "ven-8N2",
    "name": "Floor 8 North Pod 2",
    "building": "Nagarro Gurgaon Office",
    "floor": "8",
    "zone": "Sitting Area",
    "wing": "N",
    "mapZone": "north",
    "capacity": 30,
    "description": "Small-group learning pod for practical sessions and peer discussions."
  },
  {
    "id": "ven-8N3",
    "name": "Floor 8 North Pod 3",
    "building": "Nagarro Gurgaon Office",
    "floor": "8",
    "zone": "Sitting Area",
    "wing": "N",
    "mapZone": "north",
    "capacity": 20,
    "description": "Small-group learning pod for practical sessions and peer discussions."
  },
  {
    "id": "ven-8N4",
    "name": "Floor 8 North Pod 4",
    "building": "Nagarro Gurgaon Office",
    "floor": "8",
    "zone": "Sitting Area",
    "wing": "N",
    "mapZone": "north",
    "capacity": 25,
    "description": "Small-group learning pod for practical sessions and peer discussions."
  },
  {
    "id": "ven-8N5",
    "name": "Floor 8 North Pod 5",
    "building": "Nagarro Gurgaon Office",
    "floor": "8",
    "zone": "Sitting Area",
    "wing": "N",
    "mapZone": "north",
    "capacity": 30,
    "description": "Small-group learning pod for practical sessions and peer discussions."
  },
  {
    "id": "ven-8N6",
    "name": "Floor 8 North Pod 6",
    "building": "Nagarro Gurgaon Office",
    "floor": "8",
    "zone": "Sitting Area",
    "wing": "N",
    "mapZone": "north",
    "capacity": 20,
    "description": "Small-group learning pod for practical sessions and peer discussions."
  },
  {
    "id": "ven-8S1",
    "name": "Floor 8 South Pod 1",
    "building": "Nagarro Gurgaon Office",
    "floor": "8",
    "zone": "Sitting Area",
    "wing": "S",
    "mapZone": "south",
    "capacity": 25,
    "description": "Small-group learning pod for practical sessions and peer discussions."
  },
  {
    "id": "ven-8S2",
    "name": "Floor 8 South Pod 2",
    "building": "Nagarro Gurgaon Office",
    "floor": "8",
    "zone": "Sitting Area",
    "wing": "S",
    "mapZone": "south",
    "capacity": 30,
    "description": "Small-group learning pod for practical sessions and peer discussions."
  },
  {
    "id": "ven-8S3",
    "name": "Floor 8 South Pod 3",
    "building": "Nagarro Gurgaon Office",
    "floor": "8",
    "zone": "Sitting Area",
    "wing": "S",
    "mapZone": "south",
    "capacity": 20,
    "description": "Small-group learning pod for practical sessions and peer discussions.",
    "landmarks": ["cross atrium bridge", "third pod on south corridor"],
    "nearestElevator": "S",
    "stepFree": false
  },
  {
    "id": "ven-8S4",
    "name": "Floor 8 South Pod 4",
    "building": "Nagarro Gurgaon Office",
    "floor": "8",
    "zone": "Sitting Area",
    "wing": "S",
    "mapZone": "south",
    "capacity": 25,
    "description": "Small-group learning pod for practical sessions and peer discussions."
  },
  {
    "id": "ven-8S5",
    "name": "Floor 8 South Pod 5",
    "building": "Nagarro Gurgaon Office",
    "floor": "8",
    "zone": "Sitting Area",
    "wing": "S",
    "mapZone": "south",
    "capacity": 30,
    "description": "Small-group learning pod for practical sessions and peer discussions."
  },
  {
    "id": "ven-8S6",
    "name": "Floor 8 South Pod 6",
    "building": "Nagarro Gurgaon Office",
    "floor": "8",
    "zone": "Sitting Area",
    "wing": "S",